MariaDB [rgw007]> CREATE TABLE DEPT (
    ->     DEPT_CODE CHAR(4) PRIMARY KEY,
    ->     DEPT_NAME VARCHAR(50) NOT NULL,
    ->     ROOM_NUM INT NOT NULL,
    ->     BUILDING VARCHAR(50) NOT NULL
    -> );
Query OK, 0 rows affected (0.005 sec)

MariaDB [rgw007]> 
MariaDB [rgw007]> CREATE TABLE ROOM (
    ->     ROOM_NUM INT NOT NULL,
    ->     BUILDING VARCHAR(50) NOT NULL,
    ->     CAPACITY INT CHECK (CAPACITY > 0),
    ->     ROOM_TYPE VARCHAR(15),
    ->     PRIMARY KEY (ROOM_NUM, BUILDING)
    -> );
Query OK, 0 rows affected (0.004 sec)

MariaDB [rgw007]> 
MariaDB [rgw007]> CREATE TABLE PROFESSOR (
    ->     PROF_ID INT PRIMARY KEY,
    ->     PROF_NAME VARCHAR(50) NOT NULL,
    ->     RANK_TITLE VARCHAR(30),
    ->     DEPT_CODE CHAR(4) NOT NULL,
    ->     EMAIL VARCHAR(50) NOT NULL,
    ->     FOREIGN KEY (DEPT_CODE)
    ->         REFERENCES DEPT(DEPT_CODE)
    ->         ON DELETE RESTRICT
    -> );
Query OK, 0 rows affected (0.007 sec)

MariaDB [rgw007]> 
MariaDB [rgw007]> CREATE TABLE COURSE (
    ->     DEPT_CODE CHAR(4) NOT NULL,
    ->     COURSE_NUM VARCHAR(5) NOT NULL,
    ->     COURSE_NAME VARCHAR(50) NOT NULL,
    ->     CREDIT INT NOT NULL CHECK (CREDIT BETWEEN 1 AND 6),
    ->     PRIMARY KEY (DEPT_CODE, COURSE_NUM),
    ->     FOREIGN KEY (DEPT_CODE)
    ->         REFERENCES DEPT(DEPT_CODE)
    ->         ON DELETE RESTRICT
    -> );
Query OK, 0 rows affected (0.004 sec)

MariaDB [rgw007]> 
MariaDB [rgw007]> CREATE TABLE SECTION (
    ->     SID INT PRIMARY KEY,
    ->     DEPT_CODE CHAR(4) NOT NULL,
    ->     COURSE_NUM VARCHAR(5) NOT NULL,
    ->     PROF_ID INT,
    ->     ROOM_NUM INT,
    ->     BUILDING VARCHAR(50),
    ->     DAYS VARCHAR(7),
    ->     START TIME,
    ->     END TIME,
    ->     START_DAY DATE NOT NULL,
    ->     END_DAY DATE NOT NULL,
    ->     MAX_ENROLLMENT INT CHECK (MAX_ENROLLMENT >= 0),
    ->     CURRENT_ENROLLMENT INT DEFAULT 0 CHECK (CURRENT_ENROLLMENT >= 0),
    ->     CHECK (CURRENT_ENROLLMENT <= MAX_ENROLLMENT),
    -> 
    ->     FOREIGN KEY (DEPT_CODE, COURSE_NUM)
    ->         REFERENCES COURSE(DEPT_CODE, COURSE_NUM)
    ->         ON DELETE RESTRICT,
    -> 
    ->     FOREIGN KEY (PROF_ID)
    ->         REFERENCES PROFESSOR(PROF_ID)
    ->         ON DELETE CASCADE,
    -> 
    ->     FOREIGN KEY (ROOM_NUM, BUILDING)
    ->         REFERENCES ROOM(ROOM_NUM, BUILDING)
    ->         ON DELETE RESTRICT
    -> );
Query OK, 0 rows affected (0.012 sec)

MariaDB [rgw007]> 
MariaDB [rgw007]> SHOW TABLES;
+------------------+
| Tables_in_rgw007 |
+------------------+
| COURSE           |
| DEPT             |
| PROFESSOR        |
| ROOM             |
| SECTION          |
+------------------+
5 rows in set (0.000 sec)

MariaDB [rgw007]> DESC DEPT;
+-----------+-------------+------+-----+---------+-------+
| Field     | Type        | Null | Key | Default | Extra |
+-----------+-------------+------+-----+---------+-------+
| DEPT_CODE | char(4)     | NO   | PRI | NULL    |       |
| DEPT_NAME | varchar(50) | NO   |     | NULL    |       |
| ROOM_NUM  | int(11)     | NO   |     | NULL    |       |
| BUILDING  | varchar(50) | NO   |     | NULL    |       |
+-----------+-------------+------+-----+---------+-------+
4 rows in set (0.001 sec)

MariaDB [rgw007]> DESC ROOM;
+-----------+-------------+------+-----+---------+-------+
| Field     | Type        | Null | Key | Default | Extra |
+-----------+-------------+------+-----+---------+-------+
| ROOM_NUM  | int(11)     | NO   | PRI | NULL    |       |
| BUILDING  | varchar(50) | NO   | PRI | NULL    |       |
| CAPACITY  | int(11)     | YES  |     | NULL    |       |
| ROOM_TYPE | varchar(15) | YES  |     | NULL    |       |
+-----------+-------------+------+-----+---------+-------+
4 rows in set (0.000 sec)

MariaDB [rgw007]> DESC PROFESSOR;
+------------+-------------+------+-----+---------+-------+
| Field      | Type        | Null | Key | Default | Extra |
+------------+-------------+------+-----+---------+-------+
| PROF_ID    | int(11)     | NO   | PRI | NULL    |       |
| PROF_NAME  | varchar(50) | NO   |     | NULL    |       |
| RANK_TITLE | varchar(30) | YES  |     | NULL    |       |
| DEPT_CODE  | char(4)     | NO   | MUL | NULL    |       |
| EMAIL      | varchar(50) | NO   |     | NULL    |       |
+------------+-------------+------+-----+---------+-------+
5 rows in set (0.000 sec)

MariaDB [rgw007]> DESC COURSE;
+-------------+-------------+------+-----+---------+-------+
| Field       | Type        | Null | Key | Default | Extra |
+-------------+-------------+------+-----+---------+-------+
| DEPT_CODE   | char(4)     | NO   | PRI | NULL    |       |
| COURSE_NUM  | varchar(5)  | NO   | PRI | NULL    |       |
| COURSE_NAME | varchar(50) | NO   |     | NULL    |       |
| CREDIT      | int(11)     | NO   |     | NULL    |       |
+-------------+-------------+------+-----+---------+-------+
4 rows in set (0.000 sec)

MariaDB [rgw007]> DESC SECTION;
+--------------------+-------------+------+-----+---------+-------+
| Field              | Type        | Null | Key | Default | Extra |
+--------------------+-------------+------+-----+---------+-------+
| SID                | int(11)     | NO   | PRI | NULL    |       |
| DEPT_CODE          | char(4)     | NO   | MUL | NULL    |       |
| COURSE_NUM         | varchar(5)  | NO   |     | NULL    |       |
| PROF_ID            | int(11)     | YES  | MUL | NULL    |       |
| ROOM_NUM           | int(11)     | YES  | MUL | NULL    |       |
| BUILDING           | varchar(50) | YES  |     | NULL    |       |
| DAYS               | varchar(7)  | YES  |     | NULL    |       |
| START              | time        | YES  |     | NULL    |       |
| END                | time        | YES  |     | NULL    |       |
| START_DAY          | date        | NO   |     | NULL    |       |
| END_DAY            | date        | NO   |     | NULL    |       |
| MAX_ENROLLMENT     | int(11)     | YES  |     | NULL    |       |
| CURRENT_ENROLLMENT | int(11)     | YES  |     | 0       |       |
+--------------------+-------------+------+-----+---------+-------+
13 rows in set (0.000 sec)

MariaDB [rgw007]> 
MariaDB [rgw007]> 
MariaDB [rgw007]> -- DEPT
MariaDB [rgw007]> INSERT INTO DEPT VALUES
    -> ('CSCE','Computer Science & Computer Engineering',504,'JBHT'),
    -> ('ELEG','Electrical Engineering',3217,'BELL'),
    -> ('MEEG','Mechanical Engineering',204,'MEEG');
Query OK, 3 rows affected (0.001 sec)
Records: 3  Duplicates: 0  Warnings: 0

MariaDB [rgw007]> 
MariaDB [rgw007]> -- PROFESSOR
MariaDB [rgw007]> INSERT INTO PROFESSOR VALUES
    -> (123456,'Susan Gauch','Professor','CSCE','sgauch@uark.edu'),
    -> (123457,'John Gauch','Professor','CSCE','jgauch@uark.edu'),
    -> (222222,'Yanjun Pan','Assistant Professor','CSCE','yanjunp@uark.edu'),
    -> (317778,'Alan Mantooth','Distinguished Professor','ELEG','mantooth@uark.edu'),
    -> (310101,'Brajendra Panda','Professor','CSCE','bpanda@uark.edu'),
    -> (444555,'Alexander Nelson','Associate Professor','CSCE','ahnelson@uark.edu'),
    -> (555110,'Kevin Jin','Associate Professor','CSCE','dongjin@uark.edu');
Query OK, 7 rows affected (0.001 sec)
Records: 7  Duplicates: 0  Warnings: 0

MariaDB [rgw007]> 
MariaDB [rgw007]> -- COURSE
MariaDB [rgw007]> INSERT INTO COURSE VALUES
    -> ('CSCE',2004,'Programming Foundations I',3),
    -> ('CSCE',2114,'Programming Foundations II',3),
    -> ('CSCE',3193,'Programming Paradigms',3),
    -> ('CSCE','3193H','Honors Programming Paradigms',3),
    -> ('CSCE',4553,'Information Retrieval Lab',2),
    -> ('CSCE',4263,'Mobile Programming',3),
    -> ('CSCE',4623,'Advanced Data Structures',3),
    -> ('ELEG',4188,'Power Electronics',3),
    -> ('CSCE',4963,'Capstone II',3),
    -> ('CSCE',5533,'Advanced Information Retrieval',3),
    -> ('CSCE',4988,'Embedded Systems Lab',2);
Query OK, 11 rows affected (0.001 sec)
Records: 11  Duplicates: 0  Warnings: 0

MariaDB [rgw007]> 
MariaDB [rgw007]> -- ROOM
MariaDB [rgw007]> INSERT INTO ROOM VALUES
    -> (239,'JBHT',36,'Lab'),
    -> (236,'JBHT',45,'Lab'),
    -> (147,'JBHT',140,'Classroom'),
    -> (216,'JBHT',170,'Classroom'),
    -> (2269,'BELL',70,'Conference'),
    -> (2286,'BELL',100,'Classroom'),
    -> (225,'MEEG',70,'Classroom');
Query OK, 7 rows affected (0.000 sec)
Records: 7  Duplicates: 0  Warnings: 0

MariaDB [rgw007]> 
MariaDB [rgw007]> -- SECTION
MariaDB [rgw007]> INSERT INTO SECTION VALUES
    -> (9597,'CSCE',2004,222222,2269,'BELL','MWF','15:05','15:55','2023-08-21','2023-12-07',70,0),
    -> (1449,'CSCE',2114,123457,216,'JBHT','MWF','12:55','13:45','2023-08-21','2023-12-07',138,0),
    -> (2930,'CSCE',3193,222222,216,'JBHT','TR','15:30','16:45','2023-08-21','2023-12-07',140,0),
    -> (4636,'CSCE','3193H',222222,216,'JBHT','TR','15:30','16:45','2023-08-21','2023-12-07',30,0),
    -> (12550,'CSCE',4553,123456,239,'JBHT','MWF','09:40','10:30','2023-08-21','2023-12-07',30,0),
    -> (11957,'CSCE',4263,555110,239,'JBHT','TR','08:00','09:15','2023-08-21','2023-12-07',0,0),
    -> (6704,'CSCE',4623,444555,2286,'BELL','MWF','10:45','11:35','2023-08-21','2023-12-07',65,0),
    -> (6325,'CSCE',4963,444555,147,'JBHT','MWF','15:05','15:55','2023-08-21','2023-12-07',50,0),
    -> (11944,'CSCE',5533,123456,239,'JBHT','MWF','15:05','15:55','2023-08-21','2023-12-07',30,0);
Query OK, 9 rows affected (0.001 sec)
Records: 9  Duplicates: 0  Warnings: 0

MariaDB [rgw007]> SELECT * FROM  DEPT;
+-----------+-----------------------------------------+----------+----------+
| DEPT_CODE | DEPT_NAME                               | ROOM_NUM | BUILDING |
+-----------+-----------------------------------------+----------+----------+
| CSCE      | Computer Science & Computer Engineering |      504 | JBHT     |
| ELEG      | Electrical Engineering                  |     3217 | BELL     |
| MEEG      | Mechanical Engineering                  |      204 | MEEG     |
+-----------+-----------------------------------------+----------+----------+
3 rows in set (0.000 sec)

MariaDB [rgw007]> SELECT * FROM  ROOM;
+----------+----------+----------+------------+
| ROOM_NUM | BUILDING | CAPACITY | ROOM_TYPE  |
+----------+----------+----------+------------+
|      147 | JBHT     |      140 | Classroom  |
|      216 | JBHT     |      170 | Classroom  |
|      225 | MEEG     |       70 | Classroom  |
|      236 | JBHT     |       45 | Lab        |
|      239 | JBHT     |       36 | Lab        |
|     2269 | BELL     |       70 | Conference |
|     2286 | BELL     |      100 | Classroom  |
+----------+----------+----------+------------+
7 rows in set (0.000 sec)

MariaDB [rgw007]> SELECT * FROM  PROFESSOR;
+---------+------------------+-------------------------+-----------+-------------------+
| PROF_ID | PROF_NAME        | RANK_TITLE              | DEPT_CODE | EMAIL             |
+---------+------------------+-------------------------+-----------+-------------------+
|  123456 | Susan Gauch      | Professor               | CSCE      | sgauch@uark.edu   |
|  123457 | John Gauch       | Professor               | CSCE      | jgauch@uark.edu   |
|  222222 | Yanjun Pan       | Assistant Professor     | CSCE      | yanjunp@uark.edu  |
|  310101 | Brajendra Panda  | Professor               | CSCE      | bpanda@uark.edu   |
|  317778 | Alan Mantooth    | Distinguished Professor | ELEG      | mantooth@uark.edu |
|  444555 | Alexander Nelson | Associate Professor     | CSCE      | ahnelson@uark.edu |
|  555110 | Kevin Jin        | Associate Professor     | CSCE      | dongjin@uark.edu  |
+---------+------------------+-------------------------+-----------+-------------------+
7 rows in set (0.000 sec)

MariaDB [rgw007]> SELECT * FROM  COURSE;
+-----------+------------+--------------------------------+--------+
| DEPT_CODE | COURSE_NUM | COURSE_NAME                    | CREDIT |
+-----------+------------+--------------------------------+--------+
| CSCE      | 2004       | Programming Foundations I      |      3 |
| CSCE      | 2114       | Programming Foundations II     |      3 |
| CSCE      | 3193       | Programming Paradigms          |      3 |
| CSCE      | 3193H      | Honors Programming Paradigms   |      3 |
| CSCE      | 4263       | Mobile Programming             |      3 |
| CSCE      | 4553       | Information Retrieval Lab      |      2 |
| CSCE      | 4623       | Advanced Data Structures       |      3 |
| CSCE      | 4963       | Capstone II                    |      3 |
| CSCE      | 4988       | Embedded Systems Lab           |      2 |
| CSCE      | 5533       | Advanced Information Retrieval |      3 |
| ELEG      | 4188       | Power Electronics              |      3 |
+-----------+------------+--------------------------------+--------+
11 rows in set (0.000 sec)

MariaDB [rgw007]> SELECT * FROM  SECTION;
+-------+-----------+------------+---------+----------+----------+------+----------+----------+------------+------------+----------------+--------------------+
| SID   | DEPT_CODE | COURSE_NUM | PROF_ID | ROOM_NUM | BUILDING | DAYS | START    | END      | START_DAY  | END_DAY    | MAX_ENROLLMENT | CURRENT_ENROLLMENT |
+-------+-----------+------------+---------+----------+----------+------+----------+----------+------------+------------+----------------+--------------------+
|  1449 | CSCE      | 2114       |  123457 |      216 | JBHT     | MWF  | 12:55:00 | 13:45:00 | 2023-08-21 | 2023-12-07 |            138 |                  0 |
|  2930 | CSCE      | 3193       |  222222 |      216 | JBHT     | TR   | 15:30:00 | 16:45:00 | 2023-08-21 | 2023-12-07 |            140 |                  0 |
|  4636 | CSCE      | 3193H      |  222222 |      216 | JBHT     | TR   | 15:30:00 | 16:45:00 | 2023-08-21 | 2023-12-07 |             30 |                  0 |
|  6325 | CSCE      | 4963       |  444555 |      147 | JBHT     | MWF  | 15:05:00 | 15:55:00 | 2023-08-21 | 2023-12-07 |             50 |                  0 |
|  6704 | CSCE      | 4623       |  444555 |     2286 | BELL     | MWF  | 10:45:00 | 11:35:00 | 2023-08-21 | 2023-12-07 |             65 |                  0 |
|  9597 | CSCE      | 2004       |  222222 |     2269 | BELL     | MWF  | 15:05:00 | 15:55:00 | 2023-08-21 | 2023-12-07 |             70 |                  0 |
| 11944 | CSCE      | 5533       |  123456 |      239 | JBHT     | MWF  | 15:05:00 | 15:55:00 | 2023-08-21 | 2023-12-07 |             30 |                  0 |
| 11957 | CSCE      | 4263       |  555110 |      239 | JBHT     | TR   | 08:00:00 | 09:15:00 | 2023-08-21 | 2023-12-07 |              0 |                  0 |
| 12550 | CSCE      | 4553       |  123456 |      239 | JBHT     | MWF  | 09:40:00 | 10:30:00 | 2023-08-21 | 2023-12-07 |             30 |                  0 |
+-------+-----------+------------+---------+----------+----------+------+----------+----------+------------+------------+----------------+--------------------+
9 rows in set (0.000 sec)

MariaDB [rgw007]> 
MariaDB [rgw007]> # Lowest Capacity Room
MariaDB [rgw007]> SELECT BUILDING, ROOM_NUM, CAPACITY
    -> FROM ROOM
    -> WHERE CAPACITY = (
    ->     SELECT MIN(CAPACITY)
    ->     FROM ROOM
    -> );
+----------+----------+----------+
| BUILDING | ROOM_NUM | CAPACITY |
+----------+----------+----------+
| JBHT     |      239 |       36 |
+----------+----------+----------+
1 row in set (0.000 sec)

MariaDB [rgw007]> 
MariaDB [rgw007]> # Open CSCE Electives
MariaDB [rgw007]> SELECT s.COURSE_NUM,
    ->        s.DEPT_CODE,
    ->        (s.MAX_ENROLLMENT - s.CURRENT_ENROLLMENT) AS AVAILABLE_SEATS
    -> FROM SECTION s
    -> JOIN COURSE c
    ->     ON s.COURSE_NUM = c.COURSE_NUM
    ->     AND s.DEPT_CODE = c.DEPT_CODE
    -> WHERE s.DEPT_CODE = 'CSCE'
    ->     AND s.COURSE_NUM >= 4000
    ->     AND c.CREDIT >= 3
    ->     AND s.CURRENT_ENROLLMENT < s.MAX_ENROLLMENT;
+------------+-----------+-----------------+
| COURSE_NUM | DEPT_CODE | AVAILABLE_SEATS |
+------------+-----------+-----------------+
| 4963       | CSCE      |              50 |
| 4623       | CSCE      |              65 |
| 5533       | CSCE      |              30 |
+------------+-----------+-----------------+
3 rows in set, 1 warning (0.000 sec)

MariaDB [rgw007]> 
MariaDB [rgw007]> # Students Per Professor
MariaDB [rgw007]> SELECT PROF_NAME, SUM(MAX_ENROLLMENT) AS MAX_STUDENTS
    -> FROM SECTION s
    -> JOIN PROFESSOR p
    ->     ON s.PROF_ID = p.PROF_ID
    -> GROUP BY p.PROF_NAME;
+------------------+--------------+
| PROF_NAME        | MAX_STUDENTS |
+------------------+--------------+
| Alexander Nelson |          115 |
| John Gauch       |          138 |
| Kevin Jin        |            0 |
| Susan Gauch      |           60 |
| Yanjun Pan       |          240 |
+------------------+--------------+
5 rows in set (0.000 sec)

MariaDB [rgw007]> 
MariaDB [rgw007]> # Associate Professors
MariaDB [rgw007]> SELECT  p.PROF_NAME,
    ->         p.RANK_TITLE AS PROF_RANK,
    ->         d.DEPT_NAME,
    ->         d.BUILDING AS DEPT_BUILDING
    -> FROM PROFESSOR p
    -> JOIN DEPT d
    ->     ON p.DEPT_CODE = d.DEPT_CODE
    -> JOIN SECTION s
    ->     ON p.PROF_ID = s.PROF_ID
    -> GROUP BY p.PROF_ID, p.PROF_NAME, p.RANK_TITLE, d.DEPT_NAME, d.BUILDING
    -> HAVING p.RANK_TITLE IN ('Associate Professor', 'Professor')
    ->     AND COUNT(*) >= 1
    ->     AND COUNT(*) = SUM(
    ->         CASE
    ->             WHEN s.BUILDING = d.BUILDING THEN 1
    ->             ELSE 0
    ->         END
    ->     );
+-------------+---------------------+-----------------------------------------+---------------+
| PROF_NAME   | PROF_RANK           | DEPT_NAME                               | DEPT_BUILDING |
+-------------+---------------------+-----------------------------------------+---------------+
| Susan Gauch | Professor           | Computer Science & Computer Engineering | JBHT          |
| John Gauch  | Professor           | Computer Science & Computer Engineering | JBHT          |
| Kevin Jin   | Associate Professor | Computer Science & Computer Engineering | JBHT          |
+-------------+---------------------+-----------------------------------------+---------------+
3 rows in set (0.000 sec)

MariaDB [rgw007]> 
MariaDB [rgw007]> # Insert
MariaDB [rgw007]> INSERT INTO COURSE (DEPT_CODE,
    ->                     COURSE_NUM,
    ->                     COURSE_NAME,
    ->                     CREDIT )
    -> VALUES ('CSCE',
    ->         4013,
    ->         'Computer Forensics',
    ->         3);
Query OK, 1 row affected (0.001 sec)

MariaDB [rgw007]> INSERT INTO SECTION (
    ->     SID,
    ->     DEPT_CODE,
    ->     COURSE_NUM,
    ->     PROF_ID,
    ->     ROOM_NUM,
    ->     BUILDING,
    ->     DAYS,
    ->     START,
    ->     END,
    ->     START_DAY,
    ->     END_DAY,
    ->     MAX_ENROLLMENT,
    ->     CURRENT_ENROLLMENT
    -> )
    -> VALUES (
    ->     (SELECT MAX(SID) + 1 FROM SECTION),
    ->     'CSCE',
    ->     4013,
    ->     (SELECT PROF_ID FROM PROFESSOR WHERE PROF_NAME = 'Brajendra Panda'),
    ->     239,
    ->     'JBHT',
    ->     NULL,
    ->     NULL,
    ->     NULL,
    ->     '2023-08-21',
    ->     '2023-12-07',
    ->     25,
    ->     0
    -> );
Query OK, 1 row affected (0.001 sec)

MariaDB [rgw007]> 
MariaDB [rgw007]> SELECT s.*
    -> FROM SECTION s
    -> JOIN PROFESSOR p
    ->     ON s.PROF_ID = p.PROF_ID
    -> WHERE p.PROF_NAME = 'Brajendra Panda';
+-------+-----------+------------+---------+----------+----------+------+-------+------+------------+------------+----------------+--------------------+
| SID   | DEPT_CODE | COURSE_NUM | PROF_ID | ROOM_NUM | BUILDING | DAYS | START | END  | START_DAY  | END_DAY    | MAX_ENROLLMENT | CURRENT_ENROLLMENT |
+-------+-----------+------------+---------+----------+----------+------+-------+------+------------+------------+----------------+--------------------+
| 12551 | CSCE      | 4013       |  310101 |      239 | JBHT     | NULL | NULL  | NULL | 2023-08-21 | 2023-12-07 |             25 |                  0 |
+-------+-----------+------------+---------+----------+----------+------+-------+------+------------+------------+----------------+--------------------+
1 row in set (0.000 sec)

MariaDB [rgw007]> 
MariaDB [rgw007]> UPDATE SECTION
    -> SET MAX_ENROLLMENT = 100,
    ->     CURRENT_ENROLLMENT = 100
    -> WHERE DEPT_CODE = 'CSCE'
    ->     AND COURSE_NUM = '2004';
Query OK, 1 row affected (0.001 sec)
Rows matched: 1  Changed: 1  Warnings: 0

MariaDB [rgw007]> 
MariaDB [rgw007]> SELECT *
    -> FROM SECTION
    -> WHERE DEPT_CODE = 'CSCE'
    ->     AND COURSE_NUM = '2004';
+------+-----------+------------+---------+----------+----------+------+----------+----------+------------+------------+----------------+--------------------+
| SID  | DEPT_CODE | COURSE_NUM | PROF_ID | ROOM_NUM | BUILDING | DAYS | START    | END      | START_DAY  | END_DAY    | MAX_ENROLLMENT | CURRENT_ENROLLMENT |
+------+-----------+------------+---------+----------+----------+------+----------+----------+------------+------------+----------------+--------------------+
| 9597 | CSCE      | 2004       |  222222 |     2269 | BELL     | MWF  | 15:05:00 | 15:55:00 | 2023-08-21 | 2023-12-07 |            100 |                100 |
+------+-----------+------------+---------+----------+----------+------+----------+----------+------------+------------+----------------+--------------------+
1 row in set (0.000 sec)

MariaDB [rgw007]> 
MariaDB [rgw007]> SELECT c.COURSE_NUM, c.COURSE_NAME, p.PROF_NAME
    -> FROM COURSE c
    -> JOIN SECTION s
    ->     ON c.DEPT_CODE = s.DEPT_CODE
    ->     AND c.COURSE_NUM = s.COURSE_NUM
    -> JOIN PROFESSOR p
    ->     ON s.PROF_ID = p.PROF_ID
    -> WHERE c.DEPT_CODE = 'CSCE'
    ->     AND c.COURSE_NUM LIKE '4%';
+------------+---------------------------+------------------+
| COURSE_NUM | COURSE_NAME               | PROF_NAME        |
+------------+---------------------------+------------------+
| 4013       | Computer Forensics        | Brajendra Panda  |
| 4263       | Mobile Programming        | Kevin Jin        |
| 4553       | Information Retrieval Lab | Susan Gauch      |
| 4623       | Advanced Data Structures  | Alexander Nelson |
| 4963       | Capstone II               | Alexander Nelson |
+------------+---------------------------+------------------+
5 rows in set (0.000 sec)

MariaDB [rgw007]> 
MariaDB [rgw007]> DELETE FROM PROFESSOR
    -> WHERE PROF_NAME = 'Alexander Nelson';
Query OK, 1 row affected (0.000 sec)

MariaDB [rgw007]> 
MariaDB [rgw007]> SELECT c.COURSE_NUM, c.COURSE_NAME, p.PROF_NAME
    -> FROM COURSE c
    -> JOIN SECTION s
    ->     ON c.DEPT_CODE = s.DEPT_CODE
    ->     AND c.COURSE_NUM = s.COURSE_NUM
    -> JOIN PROFESSOR p
    ->     ON s.PROF_ID = p.PROF_ID
    -> WHERE c.DEPT_CODE = 'CSCE'
    ->     AND c.COURSE_NUM LIKE '4%';
+------------+---------------------------+-----------------+
| COURSE_NUM | COURSE_NAME               | PROF_NAME       |
+------------+---------------------------+-----------------+
| 4553       | Information Retrieval Lab | Susan Gauch     |
| 4013       | Computer Forensics        | Brajendra Panda |
| 4263       | Mobile Programming        | Kevin Jin       |
+------------+---------------------------+-----------------+
3 rows in set (0.000 sec)

MariaDB [rgw007]> notee
